{
  "daily" : [
    {
      "bed_local" : "23:30",
      "day" : -27,
      "dow" : "Sun",
      "exercise_min" : 20,
      "hrv_ms" : 69,
      "meals" : [
        {
          "label" : "breakfast",
          "t_local" : "08:30",
          "tags" : [
            "home-cooked"
          ]
        },
        {
          "label" : "dinner",
          "t_local" : "21:30",
          "tags" : [

          ]
        }
      ],
      "resting_hr" : 61,
      "sleep_total_min" : 435,
      "steps" : 12500,
      "wake_local" : "08:00",
      "workouts" : [

      ]
    },
    {
      "bed_local" : "23:00",
      "day" : -26,
      "dow" : "Mon",
      "exercise_min" : 35,
      "hrv_ms" : 69,
      "meals" : [
        {
          "label" : "breakfast",
          "t_local" : "08:30",
          "tags" : [
            "home-cooked"
          ]
        },
        {
          "label" : "dinner",
          "t_local" : "19:30",
          "tags" : [

          ]
        }
      ],
      "resting_hr" : 61,
      "sleep_total_min" : 385,
      "steps" : 7600,
      "wake_local" : "07:30",
      "workouts" : [
        {
          "duration_min" : 50,
          "type" : "running"
        }
      ]
    },
    {
      "bed_local" : "23:30",
      "day" : -25,
      "dow" : "Tue",
      "exercise_min" : 30,
      "hrv_ms" : 58,
      "meals" : [
        {
          "label" : "breakfast",
          "t_local" : "09:00",
          "tags" : [
            "home-cooked"
          ]
        },
        {
          "label" : "dinner",
          "t_local" : "21:00",
          "tags" : [

          ]
        }
      ],
      "resting_hr" : 60,
      "sleep_total_min" : 430,
      "steps" : 12700,
      "wake_local" : "07:30",
      "workouts" : [
        {
          "duration_min" : 50,
          "type" : "running"
        }
      ]
    },
    {
      "bed_local" : "23:30",
      "day" : -24,
      "dow" : "Wed",
      "exercise_min" : 15,
      "hrv_ms" : 50,
      "meals" : [
        {
          "label" : "breakfast",
          "t_local" : "09:00",
          "tags" : [
            "home-cooked"
          ]
        },
        {
          "label" : "dinner",
          "t_local" : "20:00",
          "tags" : [

          ]
        }
      ],
      "resting_hr" : 60,
      "sleep_total_min" : 395,
      "steps" : 7900,
      "wake_local" : "07:30",
      "workouts" : [

      ]
    },
    {
      "bed_local" : "00:00",
      "day" : -23,
      "dow" : "Thu",
      "exercise_min" : 15,
      "hrv_ms" : 31,
      "meals" : [
        {
          "label" : "breakfast",
          "t_local" : "08:30",
          "tags" : [
            "home-cooked"
          ]
        },
        {
          "label" : "dinner",
          "t_local" : "21:00",
          "tags" : [
            "late"
          ]
        }
      ],
      "resting_hr" : 61,
      "sleep_total_min" : 405,
      "steps" : 13900,
      "wake_local" : "07:30",
      "workouts" : [
        {
          "duration_min" : 30,
          "type" : "yoga"
        }
      ]
    },
    {
      "bed_local" : "23:30",
      "day" : -22,
      "dow" : "Fri",
      "exercise_min" : 55,
      "hrv_ms" : 47,
      "meals" : [
        {
          "label" : "breakfast",
          "t_local" : "09:00",
          "tags" : [
            "home-cooked"
          ]
        },
        {
          "label" : "dinner",
          "t_local" : "19:30",
          "tags" : [

          ]
        }
      ],
      "resting_hr" : 56,
      "sleep_total_min" : 430,
      "steps" : 3900,
      "wake_local" : "07:00",
      "workouts" : [
        {
          "duration_min" : 50,
          "type" : "yoga"
        }
      ]
    },
    {
      "bed_local" : "23:30",
      "day" : -21,
      "dow" : "Sat",
      "exercise_min" : 25,
      "hrv_ms" : 36,
      "meals" : [
        {
          "label" : "breakfast",
          "t_local" : "09:00",
          "tags" : [
            "home-cooked"
          ]
        },
        {
          "label" : "dinner",
          "t_local" : "20:00",
          "tags" : [
            "late"
          ]
        }
      ],
      "resting_hr" : 59,
      "sleep_total_min" : 415,
      "steps" : 3700,
      "wake_local" : "08:00",
      "workouts" : [

      ]
    },
    {
      "bed_local" : "23:30",
      "day" : -20,
      "dow" : "Sun",
      "exercise_min" : 5,
      "hrv_ms" : 49,
      "meals" : [
        {
          "label" : "breakfast",
          "t_local" : "08:30",
          "tags" : [
            "home-cooked"
          ]
        },
        {
          "label" : "dinner",
          "t_local" : "20:00",
          "tags" : [

          ]
        }
      ],
      "resting_hr" : 61,
      "sleep_total_min" : 375,
      "steps" : 9600,
      "wake_local" : "07:30",
      "workouts" : [

      ]
    },
    {
      "bed_local" : "00:00",
      "day" : -19,
      "dow" : "Mon",
      "exercise_min" : 35,
      "hrv_ms" : 33,
      "meals" : [
        {
          "label" : "breakfast",
          "t_local" : "08:30",
          "tags" : [
            "home-cooked"
          ]
        },
        {
          "label" : "dinner",
          "t_local" : "19:30",
          "tags" : [

          ]
        }
      ],
      "resting_hr" : 54,
      "sleep_total_min" : 405,
      "steps" : 5800,
      "wake_local" : "07:00",
      "workouts" : [
        {
          "duration_min" : 40,
          "type" : "strength"
        }
      ]
    },
    {
      "bed_local" : "23:00",
      "day" : -18,
      "dow" : "Tue",
      "exercise_min" : 40,
      "hrv_ms" : 61,
      "meals" : [
        {
          "label" : "breakfast",
          "t_local" : "08:30",
          "tags" : [
            "home-cooked"
          ]
        },
        {
          "label" : "dinner",
          "t_local" : "19:00",
          "tags" : [
            "late"
          ]
        }
      ],
      "resting_hr" : 56,
      "sleep_total_min" : 385,
      "steps" : 5800,
      "wake_local" : "07:30",
      "workouts" : [
        {
          "duration_min" : 45,
          "type" : "running"
        }
      ]
    },
    {
      "bed_local" : "23:00",
      "day" : -17,
      "dow" : "Wed",
      "exercise_min" : 10,
      "hrv_ms" : 50,
      "meals" : [
        {
          "label" : "breakfast",
          "t_local" : "08:00",
          "tags" : [
            "home-cooked"
          ]
        },
        {
          "label" : "dinner",
          "t_local" : "20:00",
          "tags" : [
            "late"
          ]
        }
      ],
      "resting_hr" : 54,
      "sleep_total_min" : 385,
      "steps" : 12100,
      "wake_local" : "07:30",
      "workouts" : [

      ]
    },
    {
      "bed_local" : "00:00",
      "day" : -16,
      "dow" : "Thu",
      "exercise_min" : 45,
      "hrv_ms" : 47,
      "meals" : [
        {
          "label" : "breakfast",
          "t_local" : "08:00",
          "tags" : [
            "home-cooked"
          ]
        },
        {
          "label" : "dinner",
          "t_local" : "19:30",
          "tags" : [
            "late"
          ]
        }
      ],
      "resting_hr" : 59,
      "sleep_total_min" : 405,
      "steps" : 5700,
      "wake_local" : "08:00",
      "workouts" : [
        {
          "duration_min" : 45,
          "type" : "strength"
        }
      ]
    },
    {
      "bed_local" : "23:00",
      "day" : -15,
      "dow" : "Fri",
      "exercise_min" : 5,
      "hrv_ms" : 44,
      "meals" : [
        {
          "label" : "breakfast",
          "t_local" : "08:30",
          "tags" : [
            "home-cooked"
          ]
        },
        {
          "label" : "dinner",
          "t_local" : "19:00",
          "tags" : [

          ]
        }
      ],
      "resting_hr" : 58,
      "sleep_total_min" : 350,
      "steps" : 13400,
      "wake_local" : "07:30",
      "workouts" : [

      ]
    },
    {
      "bed_local" : "23:30",
      "day" : -14,
      "dow" : "Sat",
      "exercise_min" : 50,
      "hrv_ms" : 59,
      "meals" : [
        {
          "label" : "breakfast",
          "t_local" : "08:30",
          "tags" : [
            "home-cooked"
          ]
        },
        {
          "label" : "dinner",
          "t_local" : "19:00",
          "tags" : [
            "late"
          ]
        }
      ],
      "resting_hr" : 54,
      "sleep_total_min" : 345,
      "steps" : 12700,
      "wake_local" : "07:30",
      "workouts" : [

      ]
    },
    {
      "bed_local" : "23:30",
      "day" : -13,
      "dow" : "Sun",
      "exercise_min" : 40,
      "hrv_ms" : 35,
      "meals" : [
        {
          "label" : "breakfast",
          "t_local" : "08:30",
          "tags" : [
            "home-cooked"
          ]
        },
        {
          "label" : "dinner",
          "t_local" : "19:30",
          "tags" : [
            "late"
          ]
        }
      ],
      "resting_hr" : 57,
      "sleep_total_min" : 370,
      "steps" : 7500,
      "wake_local" : "07:30",
      "workouts" : [

      ]
    },
    {
      "bed_local" : "23:30",
      "day" : -12,
      "dow" : "Mon",
      "exercise_min" : 5,
      "hrv_ms" : 63,
      "meals" : [
        {
          "label" : "breakfast",
          "t_local" : "08:30",
          "tags" : [
            "home-cooked"
          ]
        },
        {
          "label" : "dinner",
          "t_local" : "20:00",
          "tags" : [

          ]
        }
      ],
      "resting_hr" : 56,
      "sleep_total_min" : 350,
      "steps" : 13100,
      "wake_local" : "07:30",
      "workouts" : [

      ]
    },
    {
      "bed_local" : "23:00",
      "day" : -11,
      "dow" : "Tue",
      "exercise_min" : 0,
      "hrv_ms" : 31,
      "meals" : [
        {
          "label" : "breakfast",
          "t_local" : "09:00",
          "tags" : [
            "home-cooked"
          ]
        },
        {
          "label" : "dinner",
          "t_local" : "21:30",
          "tags" : [

          ]
        }
      ],
      "resting_hr" : 57,